,date,description,language,source,text,title,url,title_compound,title_pos,title_neu,title_neg,title_sent,text_compound,text_pos,text_neu,text_neg,text_sent,tokens
61,2022-06-16,"If you’re worried about a smaller 529 college savings plan balance, it may make sense to try and claim other credits while waiting for the account to recover.",en,"{'id': None, 'name': 'CNBC'}",The latest stock market decline may be troublesome if you're relying on a now-smaller 529 plan balance to cover college tuition this fall. But crafting a multi-year tax strategy may be one way to lig… [+3697 chars],College tuition bills are coming. Here are 3 ways to navigate them and give your 529 balance time to recover,https://www.cnbc.com/2022/06/16/how-to-navigate-college-tuition-and-help-your-529-balance-recover.html,0.0,0.0,1.0,0.0,0,-0.2846,0.0,0.941,0.059,-1,"['latest', 'stock', 'market', 'decline', 'may', 'troublesome', ""'re"", 'relying', 'now-smaller', '529', 'plan', 'balance', 'cover', 'college', 'tuition', 'fall', 'crafting', 'multi-year', 'tax', 'strategy', 'may', 'one', 'way', 'lig…', '+3697']"
62,2022-07-06,"Federal Reserve officials recognized that a ""more restrictive stance"" in policy could be suitable if inflation doesn't ease, the meeting minutes said.",en,"{'id': None, 'name': 'CNBC'}","SINGAPORE Asia-Pacific markets traded higher on Thursday as investors watch for market reaction to the latest Fed minutes.
Japan's Nikkei 225 gained 0.83%, and the Topix index rose 0.84%%.
In South… [+2137 chars]",Asia-Pacific markets poised to open mixed as investors react to Fed minutes,https://www.cnbc.com/2022/07/07/asia-markets-fed-minutes-currencies-oil.html,0.25,0.154,0.846,0.0,1,0.3818,0.075,0.925,0.0,1,"['SINGAPORE', 'Asia-Pacific', 'market', 'traded', 'higher', 'Thursday', 'investor', 'watch', 'market', 'reaction', 'latest', 'Fed', 'minute', 'Japan', 'Nikkei', '225', 'gained', '0.83', 'Topix', 'index', 'rose', '0.84', 'South…', '+2137']"
63,2022-07-13,Futures in the Asia-Pacific are poised to open lower on Thursday after a hotter-than-expected inflation report in the U.S.,en,"{'id': None, 'name': 'CNBC'}","SINGAPORE Futures in Asia-Pacific are poised to open lower Thursday after a hotter-than-expected inflation report in the U.S.
The Nikkei futures contract in Chicago was at 26,405 while its counterpa… [+1569 chars]",Asia-Pacific markets set to fall after U.S. inflation rises faster than expected,https://www.cnbc.com/2022/07/14/asia-markets-us-inflation-data-gdp-unemployment-earnings.html,0.0,0.0,1.0,0.0,0,-0.0516,0.06,0.873,0.066,-1,"['SINGAPORE', 'Futures', 'Asia-Pacific', 'poised', 'open', 'lower', 'Thursday', 'hotter-than-expected', 'inflation', 'report', 'U.S', 'Nikkei', 'future', 'contract', 'Chicago', '26,405', 'counterpa…', '+1569']"
64,2022-07-13,Stock futures fell Wednesday night ahead of Thursday's session.,en,"{'id': None, 'name': 'CNBC'}","Stock futures slipped Wednesday night as traders look ahead to earnings from major U.S. banks.
Dow Jones Industrial Average futures shed 62 points, or 0.20%. S&amp;P 500 and Nasdaq 100 futures were … [+1445 chars]",Stock futures slip after Wednesday's session as Wall Street awaits bank earnings,https://www.cnbc.com/2022/07/13/stock-futures-slip-after-wednesdays-session-as-wall-street-awaits-bank-earnings.html,0.0772,0.106,0.894,0.0,1,0.0,0.0,1.0,0.0,0,"['Stock', 'future', 'slipped', 'Wednesday', 'night', 'trader', 'look', 'ahead', 'earnings', 'major', 'U.S.', 'bank', 'Dow', 'Jones', 'Industrial', 'Average', 'future', 'shed', '62', 'point', '0.20', 'P', 'Nasdaq', '100', 'future', '+1445']"
65,2022-07-10,"Wall Street is looking ahead to big company earnings reports and key inflation data, on the heels of a strong employment report.",en,"{'id': None, 'name': 'CNBC'}","U.S. equities futures dipped slightly Sunday evening as Wall Street looked ahead to big company earnings reports and key inflation data, on the heels of a strong employment report.
Futures tied to t… [+2653 chars]",S&P 500 futures edge lower ahead of kickoff to earnings season,https://www.cnbc.com/2022/07/10/stock-market-futures-open-to-close-news.html,-0.296,0.0,0.82,0.18,-1,0.5106,0.091,0.909,0.0,1,"['U.S.', 'equity', 'future', 'dipped', 'slightly', 'Sunday', 'evening', 'Wall', 'Street', 'looked', 'ahead', 'big', 'company', 'earnings', 'report', 'key', 'inflation', 'data', 'heel', 'strong', 'employment', 'report', 'Futures', 'tied', 't…', '+2653']"
66,2022-06-17,"""That said, I think the economy has already weakened substantially here, so the pain might be over faster than you'd expect,"" Cramer said.",en,"{'id': None, 'name': 'CNBC'}","CNBC's Jim Cramer on Friday warned investors that any upcoming market rallies will be temporary as the Federal Reserve turns up the heat in its fight against inflation.
""Until we see a pattern of hi… [+2841 chars]",Cramer’s week ahead: 'Sell stocks into any rally’ as the Fed curbs any market bounce,https://www.cnbc.com/2022/06/17/cramers-week-ahead-sell-stocks-into-any-rally.html,0.0,0.0,1.0,0.0,0,-0.5719,0.0,0.879,0.121,-1,"['CNBC', 'Jim', 'Cramer', 'Friday', 'warned', 'investor', 'upcoming', 'market', 'rally', 'temporary', 'Federal', 'Reserve', 'turn', 'heat', 'fight', 'inflation', 'see', 'pattern', 'hi…', '+2841']"
67,2022-06-30,"""You have to be selective, which means sticking with the winners that we know are doing well,"" he said.",en,"{'id': None, 'name': 'CNBC'}","CNBC's Jim Cramer on Thursday gave investors three options for packaged food stocks they can seek refuge in, as the stock market continues to seesaw.
""With commodity costs coming down big, the food … [+2575 chars]",Jim Cramer says investors can hide in these three recession-proof packaged food stocks,https://www.cnbc.com/2022/06/30/jim-cramer-says-investors-can-hide-in-these-three-recession-proof-packaged-food-stocks.html,-0.1779,0.0,0.876,0.124,-1,0.0,0.0,1.0,0.0,0,"['CNBC', 'Jim', 'Cramer', 'Thursday', 'gave', 'investor', 'three', 'option', 'packaged', 'food', 'stock', 'seek', 'refuge', 'stock', 'market', 'continues', 'seesaw', 'commodity', 'cost', 'coming', 'big', 'food', '+2575']"
68,2022-06-14,"""The charts, as interpreted by Carley Garner, suggest this week could be a key moment for the S&P 500,"" the ""Mad Money"" host said.",en,"{'id': None, 'name': 'CNBC'}","CNBC's Jim Cramer on Tuesday said that there could be a ""key moment"" for investors to do some buying in the S&amp;P 500 this week, leaning on analysis from DeCarley Trading market strategist Carley G… [+2489 chars]","Charts suggest this week could be a ‘key moment’ for the S&P 500, Jim Cramer says",https://www.cnbc.com/2022/06/14/cramer-charts-suggest-this-week-could-be-a-key-moment-for-sp-500.html,0.0,0.0,1.0,0.0,0,0.0,0.0,1.0,0.0,0,"['CNBC', 'Jim', 'Cramer', 'Tuesday', 'said', 'could', 'key', 'moment', 'investor', 'buying', 'P', 'week', 'leaning', 'analysis', 'DeCarley', 'Trading', 'market', 'strategist', 'Carley', 'G…', '+2489']"
69,2022-06-24,"Polestar's SPAC deal has closed, and it now plans an aggressive global expansion",en,"{'id': None, 'name': 'CNBC'}","Shares of Polestar are set to debut under the ticker ""PSNY"" on Friday, making it the latest electric vehicle maker to go public via a merger with a special purpose acquisition company, or SPAC.
Pole… [+3270 chars]",Polestar set to become latest electric vehicle maker to go public via SPAC merger,https://www.cnbc.com/2022/06/24/polestar-psny-nasdaq-debut-growth-plans-2025.html,0.0,0.0,1.0,0.0,0,0.5994,0.129,0.871,0.0,1,"['Shares', 'Polestar', 'set', 'debut', 'ticker', 'PSNY', 'Friday', 'making', 'latest', 'electric', 'vehicle', 'maker', 'go', 'public', 'via', 'merger', 'special', 'purpose', 'acquisition', 'company', 'SPAC', 'Pole…', '+3270']"
70,2022-06-15,"Since a 2019 federal securities ruling made it easier to offer actively managed ETFs, a growing number of funds using that strategy have come to market.",en,"{'id': None, 'name': 'CNBC'}","Amid ongoing market volatility, actively managed exchange-traded funds may have a place in your portfolio.
Most ETFs, which trade throughout the day like stocks, are passively managed which means a … [+2752 chars]",Investors have access to more actively managed exchange-traded funds. Here's how they may help during market volatility,https://www.cnbc.com/2022/06/15/how-actively-managed-etfs-may-help-during-market-volatility.html,0.6478,0.261,0.739,0.0,1,0.4767,0.143,0.806,0.051,1,"['Amid', 'ongoing', 'market', 'volatility', 'actively', 'managed', 'exchange-traded', 'fund', 'may', 'place', 'portfolio', 'ETFs', 'trade', 'throughout', 'day', 'like', 'stock', 'passively', 'managed', 'mean', '+2752']"
71,2022-07-06,Money manager Dan Suzuki of Richard Bernstein Advisors warns the market is far from bottoming - and it's a concept investors fail to grasp.,en,"{'id': None, 'name': 'CNBC'}","The recent tech rally may be doomed.
Money manager Dan Suzuki of Richard Bernstein Advisors warns the market is far from bottoming and it's a concept investors fail to grasp, particularly when it co… [+2629 chars]",Wrong time to get bullish: Top investor warns deflating tech ‘bubble’ far from over,https://www.cnbc.com/2022/07/05/wrong-time-to-get-bullish-investor-delivers-new-tech-bubble-warning.html,-0.4019,0.104,0.636,0.26,-1,-0.8442,0.0,0.779,0.221,-1,"['recent', 'tech', 'rally', 'may', 'doomed', 'Money', 'manager', 'Dan', 'Suzuki', 'Richard', 'Bernstein', 'Advisors', 'warns', 'market', 'far', 'bottoming', 'concept', 'investor', 'fail', 'grasp', 'particularly', 'co…', '+2629']"
72,2022-06-30,Worries over higher interest rates drove investors into safer and slower-growing pockets of the economy in the second quarter as Tesla stock cratered 37%.,en,"{'id': None, 'name': 'CNBC'}","Investors lowered the valuations of the world's largest technology companies in the second quarter as central bankers ratcheted up interest rates to ward off inflation.
Big technology names became l… [+2346 chars]","Big technology stocks like Tesla, Amazon and Microsoft just finished their worst quarter in years",https://www.cnbc.com/2022/06/30/tech-stocks-q2-2022-worst-quarter-in-years-for-tsla-amzn-msft-goog.html,-0.2263,0.207,0.591,0.202,-1,0.3612,0.087,0.87,0.043,1,"['Investors', 'lowered', 'valuation', 'world', 'largest', 'technology', 'company', 'second', 'quarter', 'central', 'banker', 'ratcheted', 'interest', 'rate', 'ward', 'inflation', 'Big', 'technology', 'name', 'became', 'l…', '+2346']"
73,2022-07-11,"Tuesday is quiet on the data front, but investors will look ahead to the upcoming U.S. inflation report and China GDP report later this week.",en,"{'id': None, 'name': 'CNBC'}","SINGAPORE Futures in the Asia-Pacific are pointing to a lower open on Tuesday after Wall Street slipped overnight.
The Nikkei futures contract in Chicago was at 26,625 while its counterpart in Osaka… [+1333 chars]",Asia-Pacific markets set to trade lower after U.S. stocks fell,https://www.cnbc.com/2022/07/12/asia-markets-stocks-company-news-currencies-covid-oil.html,-0.296,0.0,0.804,0.196,-1,-0.296,0.0,0.936,0.064,-1,"['SINGAPORE', 'Futures', 'Asia-Pacific', 'pointing', 'lower', 'open', 'Tuesday', 'Wall', 'Street', 'slipped', 'overnight', 'Nikkei', 'future', 'contract', 'Chicago', '26,625', 'counterpart', 'Osaka…', '+1333']"
74,2022-06-23,Shares in the Asia-Pacific were mixed on Friday as investors weigh recession fears.,en,"{'id': None, 'name': 'CNBC'}","SINGAPORE Shares in the Asia-Pacific region were mixed on Friday as investors weigh recession fears.
In Japan markets, the Nikkei 225 rose 0.13%, while the Topix declined 0.11%.
South Korea's Kospi… [+1447 chars]",Asia-Pacific stocks trade mixed as markets monitor recession concerns,https://www.cnbc.com/2022/06/24/asia-markets-currencies-oil-wall-street-stock-debut.html,-0.4215,0.0,0.741,0.259,-1,-0.5267,0.058,0.794,0.148,-1,"['SINGAPORE', 'Shares', 'Asia-Pacific', 'region', 'mixed', 'Friday', 'investor', 'weigh', 'recession', 'fear', 'Japan', 'market', 'Nikkei', '225', 'rose', '0.13', 'Topix', 'declined', '0.11', 'South', 'Korea', 'Kospi…', '+1447']"
75,2022-06-29,Shares in the Asia Pacific look set to open lower as investors await data from China.,en,"{'id': None, 'name': 'CNBC'}","SINGAPORE Shares in the Asia Pacific fell at the market open on Thursday as investors await data from China.
The Nikkei 225 in Japan dropped 0.72% in early trade, while the Topix slipped 0.76%
In A… [+1615 chars]",Asia-Pacific markets set to open lower; China PMI data ahead,https://www.cnbc.com/2022/06/30/asia-markets-china-pmi-data-stocks-currencies-oil.html,-0.296,0.0,0.804,0.196,-1,0.3818,0.091,0.909,0.0,1,"['SINGAPORE', 'Shares', 'Asia', 'Pacific', 'fell', 'market', 'open', 'Thursday', 'investor', 'await', 'data', 'China', 'Nikkei', '225', 'Japan', 'dropped', '0.72', 'early', 'trade', 'Topix', 'slipped', '0.76', 'A…', '+1615']"
76,2022-06-16,The Bank of Japan is set to release its monetary policy statement at 11:00 a.m. HK/SIN on Friday.,en,"{'id': None, 'name': 'CNBC'}","SINGAPORE Shares in Asia-Pacific looked set for a lower start on Friday, following sharp declines on Wall Street as investors weigh the possibility of aggressive monetary policy tightening leading to… [+1734 chars]",Asia-Pacific stocks set for lower start as recession fears weigh on investor sentiment,https://www.cnbc.com/2022/06/17/asia-markets-bank-of-japan-federal-reserve-bank-of-england-swiss-national-bank-currencies-oil.html,-0.7783,0.0,0.562,0.438,-1,-0.1531,0.065,0.824,0.112,-1,"['SINGAPORE', 'Shares', 'Asia-Pacific', 'looked', 'set', 'lower', 'start', 'Friday', 'following', 'sharp', 'decline', 'Wall', 'Street', 'investor', 'weigh', 'possibility', 'aggressive', 'monetary', 'policy', 'tightening', 'leading', 'to…', '+1734']"
77,2022-06-22,Shares in the Asia-Pacific were set to open mixed on Thursday as recession fears grow.,en,"{'id': None, 'name': 'CNBC'}","SINGAPORE Shares in the Asia-Pacific were set to open lower on Thursday as investors continued to monitor recession concerns.
In Japan markets, the Nikkei futures contract in Chicago was at 26,135, … [+1376 chars]",Asia-Pacific markets set to open lower as investors weigh recession fears,https://www.cnbc.com/2022/06/23/asia-pacific-markets-recession-fears-oil-prices-currencies.html,-0.7783,0.0,0.506,0.494,-1,-0.4215,0.059,0.806,0.134,-1,"['SINGAPORE', 'Shares', 'Asia-Pacific', 'set', 'open', 'lower', 'Thursday', 'investor', 'continued', 'monitor', 'recession', 'concern', 'Japan', 'market', 'Nikkei', 'future', 'contract', 'Chicago', '26,135', '+1376']"
78,2022-06-27,Futures in the Asia-Pacific region were lower on Tuesday as positive sentiment in the markets from last week starts to wane.,en,"{'id': None, 'name': 'CNBC'}","SINGAPORE Futures in the Asia-Pacific region were lower on Tuesday as positive sentiment in the markets from last week starts to wane.
Japanese stocks were posed to open lower. The Nikkei futures co… [+949 chars]",Asia-Pacific stocks set to trade lower as positive sentiment wanes,https://www.cnbc.com/2022/06/28/asia-markets-stocks-earnings-currencies-oil.html,0.34,0.261,0.58,0.159,1,0.0516,0.09,0.8,0.11,1,"['SINGAPORE', 'Futures', 'Asia-Pacific', 'region', 'lower', 'Tuesday', 'positive', 'sentiment', 'market', 'last', 'week', 'start', 'wane', 'Japanese', 'stock', 'posed', 'open', 'lower', 'Nikkei', 'future', 'co…', '+949']"
79,2022-07-07,Futures in Asia-Pacific point to a mixed open on Friday as investors look ahead to the release of U.S. jobs data for June.,en,"{'id': None, 'name': 'CNBC'}","SINGAPORE Futures in Asia-Pacific point to a mixed open on Friday as investors look ahead to the release of U.S. jobs data for June.
The Nikkei futures contract in Chicago was at 26,670 while its co… [+1226 chars]",Asia-Pacific markets set to trade mixed ahead of U.S. jobs report,https://www.cnbc.com/2022/07/08/asia-markets-us-jobs-report-politics-fed.html,0.0,0.0,1.0,0.0,0,0.0,0.0,1.0,0.0,0,"['SINGAPORE', 'Futures', 'Asia-Pacific', 'point', 'mixed', 'open', 'Friday', 'investor', 'look', 'ahead', 'release', 'U.S.', 'job', 'data', 'June', 'Nikkei', 'future', 'contract', 'Chicago', '26,670', 'co…', '+1226']"
80,2022-06-21,"Shares in the Asia-Pacific region were set to open mixed on Wednesday, after a strong lead from Wall Street following a long weekend.",en,"{'id': None, 'name': 'CNBC'}","SINGAPORE Shares in the Asia-Pacific region were set to open mixed on Wednesday, as Wall Street bounced back after a turbulent week last week. Investors will be looking ahead to the minutes from Bank… [+787 chars]",Asia-Pacific stocks poised to open mixed as Wall Street bounces back,https://www.cnbc.com/2022/06/22/asia-pacific-markets-wall-street-bank-of-japan-currencies-oil.html,0.25,0.167,0.833,0.0,1,0.296,0.061,0.939,0.0,1,"['SINGAPORE', 'Shares', 'Asia-Pacific', 'region', 'set', 'open', 'mixed', 'Wednesday', 'Wall', 'Street', 'bounced', 'back', 'turbulent', 'week', 'last', 'week', 'Investors', 'looking', 'ahead', 'minute', 'Bank…', '+787']"
81,2022-06-28,Futures in the Asia-Pacific pointed to a lower open on Wednesday after Wall Street's negative performance on Tuesday.,en,"{'id': None, 'name': 'CNBC'}",SINGAPORE Futures in the Asia-Pacific pointed to a lower open on Wednesday after Wall Street's negative performance on Tuesday. Investors will also be looking forward to Australia's retail sales repo… [+1165 chars],Shares in the Asia Pacific set to open lower; Australia retail sales data ahead,https://www.cnbc.com/2022/06/29/asia-markets-wall-street-consumer-confidence-currencies-and-oil.html,0.0,0.134,0.732,0.134,0,-0.7096,0.0,0.831,0.169,-1,"['SINGAPORE', 'Futures', 'Asia-Pacific', 'pointed', 'lower', 'open', 'Wednesday', 'Wall', 'Street', 'negative', 'performance', 'Tuesday', 'Investors', 'also', 'looking', 'forward', 'Australia', 'retail', 'sale', 'repo…', '+1165']"
82,2022-06-17,"Interest rates are going up, and the economy is showing signs of cooling. Market-related stresses are starting to show.",en,"{'id': None, 'name': 'CNBC'}","US Federal Reserve Chairman Jerome Powell speaks during a news conference in Washington, DC, on May 4, 2022.
We have reached the ""be careful what you wish for"" moment for Federal Reserve policy.
Af… [+4419 chars]",Insana: ‘Be careful what you wish for’ as the Fed steps up aggression on monetary policy,https://www.cnbc.com/2022/06/17/insana-be-careful-what-you-wish-for-as-the-fed-steps-up-aggression-on-monetary-policy.html,0.2732,0.221,0.667,0.113,1,0.5719,0.151,0.849,0.0,1,"['US', 'Federal', 'Reserve', 'Chairman', 'Jerome', 'Powell', 'speaks', 'news', 'conference', 'Washington', 'DC', 'May', '4', '2022', 'reached', 'careful', 'wish', 'moment', 'Federal', 'Reserve', 'policy', 'Af…', '+4419']"
83,2022-07-08,June consumer inflation data and the start of the second quarter earnings season could be two catalysts that make for bumpy markets in the week ahead.,en,"{'id': None, 'name': 'CNBC'}","Traders on the floor of the NYSE, June 29, 2022.
Consumer inflation data and the start of the second quarter earnings season could be two catalysts that make for a bumpy ride in markets in the week … [+5542 chars]",Another hot inflation report and the start of earnings season make for a challenging week ahead,https://www.cnbc.com/2022/07/08/another-hot-inflation-report-q2-earnings-make-for-difficult-week-ahead.html,0.1531,0.103,0.897,0.0,1,0.0,0.0,1.0,0.0,0,"['Traders', 'floor', 'NYSE', 'June', '29', '2022', 'Consumer', 'inflation', 'data', 'start', 'second', 'quarter', 'earnings', 'season', 'could', 'two', 'catalyst', 'make', 'bumpy', 'ride', 'market', 'week', '+5542']"
84,2022-06-16,U.S. stock futures sank Thursday as the post-Fed meeting rally proved to be short-lived.,en,"{'id': None, 'name': 'CNBC'}","Here are the most important news, trends and analysis that investors need to start their trading day:
1. Wall Street set to plunge as stocks' post-Fed rate hike rally vanishes
A screen displays the… [+4953 chars]",5 things to know before the stock market opens Thursday,https://www.cnbc.com/2022/06/16/5-things-to-know-before-the-stock-market-opens-thursday-june-16.html,0.0,0.0,1.0,0.0,0,0.2716,0.058,0.942,0.0,1,"['important', 'news', 'trend', 'analysis', 'investor', 'need', 'start', 'trading', 'day', '1', 'Wall', 'Street', 'set', 'plunge', 'stock', 'post-Fed', 'rate', 'hike', 'rally', 'vanishes', 'screen', 'display', 'the…', '+4953']"
85,2022-06-14,"Chinese economic data, including industrial production and retail sales for May, is set to be out on Wednesday.",en,"{'id': None, 'name': 'CNBC'}","SINGAPORE Shares in Asia-Pacific appeared set for a lower start on Wednesday following overnight losses on Wall Street as the S&amp;P 500 fell deeper into bear market territory. 
Investors in the re… [+1880 chars]","Asia-Pacific stocks set for lower start; China's May retail sales, industrial production out ahead",https://www.cnbc.com/2022/06/15/asia-markets-chinese-economy-federal-reserve-us-treasurys-currencies-oil.html,-0.296,0.0,0.855,0.145,-1,-0.4019,0.059,0.809,0.132,-1,"['SINGAPORE', 'Shares', 'Asia-Pacific', 'appeared', 'set', 'lower', 'start', 'Wednesday', 'following', 'overnight', 'loss', 'Wall', 'Street', 'P', 'fell', 'deeper', 'bear', 'market', 'territory', 'Investors', 're…', '+1880']"
86,2022-06-20,European stocks are expected to open lower on Monday after a tumultuous trading week last week.,en,"{'id': None, 'name': 'CNBC'}","LONDON European stocks are expected to open lower on Monday after a tumultuous trading week last week.
The U.K.'s FTSE index is seen opening 15 points lower at 6,980, Germany's DAX 28 points lower a… [+1367 chars]",European markets set for lower open as investors reflect on economic uncertainty,https://www.cnbc.com/2022/06/20/european-markets-open-to-close-data-earnings-central-banks.html,-0.5574,0.0,0.685,0.315,-1,-0.6808,0.0,0.833,0.167,-1,"['LONDON', 'European', 'stock', 'expected', 'open', 'lower', 'Monday', 'tumultuous', 'trading', 'week', 'last', 'week', 'U.K.', 'FTSE', 'index', 'seen', 'opening', '15', 'point', 'lower', '6,980', 'Germany', 'DAX', '28', 'point', 'lower', 'a…', '+1367']"
87,2022-06-15,The Federal Reserve raised benchmark interest rates 75 basis points on Wednesday in a move that equates to the most aggressive hike since 1994.,en,"{'id': None, 'name': 'CNBC'}","SINGAPORE Asia-Pacific markets were set to rise on Thursday, tracking U.S. stocks after the Federal Reserve raised benchmark interest rates 75 basis points in a move that equates to the most aggressi… [+1721 chars]",Asia-Pacific markets set to rise after largest Fed rate hike since 1994,https://www.cnbc.com/2022/06/16/asia-pacific-markets-fed-raises-rate-oil-prices-and-currencies.html,0.0,0.0,1.0,0.0,0,0.4588,0.086,0.914,0.0,1,"['SINGAPORE', 'Asia-Pacific', 'market', 'set', 'rise', 'Thursday', 'tracking', 'U.S.', 'stock', 'Federal', 'Reserve', 'raised', 'benchmark', 'interest', 'rate', '75', 'basis', 'point', 'move', 'equates', 'aggressi…', '+1721']"
88,2022-07-11,Traders are piling into exchange-traded funds that bet against US stocks as the risk of recession and disappointment from the upcoming earnings season bolsters bearish sentiment in the market.,en,"{'id': 'bloomberg', 'name': 'Bloomberg'}","Traders are piling into exchange-traded funds that bet against US stocks as the risk of recession and disappointment from the upcoming earnings season bolsters bearish sentiment in the market.
Inves… [+1847 chars]",Leveraged ETFs Betting Against US Stocks Draw in $1.4 Billion - Bloomberg,https://www.bloomberg.com/news/articles/2022-07-11/leveraged-etfs-betting-against-us-stocks-draw-in-1-4-billion,0.0,0.0,1.0,0.0,0,-0.802,0.0,0.78,0.22,-1,"['Traders', 'piling', 'exchange-traded', 'fund', 'bet', 'US', 'stock', 'risk', 'recession', 'disappointment', 'upcoming', 'earnings', 'season', 'bolster', 'bearish', 'sentiment', 'market', 'Inves…', '+1847']"
89,2022-07-14,Asia-Pacific stocks are set to trade mixed Friday ahead of China data including GDP and retail sales.,en,"{'id': None, 'name': 'CNBC'}","SINGAPORE Asia-Pacific stocks are set to trade mixed Friday ahead of China data including GDP and retail sales numbers.
The Nikkei futures contract in Chicago was at 26,770 while its counterpart in … [+1823 chars]",Asia-Pacific stocks set to trade mixed ahead of China GDP data,https://www.cnbc.com/2022/07/15/asia-markets-china-gdp-industrial-production-retail-sales.html,0.0,0.0,1.0,0.0,0,0.0,0.0,1.0,0.0,0,"['SINGAPORE', 'Asia-Pacific', 'stock', 'set', 'trade', 'mixed', 'Friday', 'ahead', 'China', 'data', 'including', 'GDP', 'retail', 'sale', 'number', 'Nikkei', 'future', 'contract', 'Chicago', '26,770', 'counterpart', '+1823']"
90,2022-07-01,"Investors are greeting the third quarter with a greater fear of recession, and that makes data like Friday's jobs report a potentially bigger market catalyst.",en,"{'id': None, 'name': 'CNBC'}","Traders work on the floor of the New York Stock Exchange.
Investors are greeting the third quarter with greater trepidation about a recession, and that makes next Friday's June jobs report a potenti… [+7244 chars]",Recession fears flare and June jobs report looms as jittery markets head into third quarter,https://www.cnbc.com/2022/07/01/recession-fears-flare-and-jobs-report-looms-as-markets-head-to-q3-.html,-0.7351,0.0,0.625,0.375,-1,0.3182,0.135,0.792,0.074,1,"['Traders', 'work', 'floor', 'New', 'York', 'Stock', 'Exchange', 'Investors', 'greeting', 'third', 'quarter', 'greater', 'trepidation', 'recession', 'make', 'next', 'Friday', 'June', 'job', 'report', 'potenti…', '+7244']"
