,date,description,language,source,text,title,url,title_compound,title_pos,title_neu,title_neg,title_sent,text_compound,text_pos,text_neu,text_neg,text_sent,tokens
91,2022-06-30,Asia-Pacific futures pointed to a lower open on the first day of a new quarter as investors await the results of a private survey on Chinese factory activity.,en,"{'id': None, 'name': 'CNBC'}","SINGAPORE Asia-Pacific futures pointed to a lower open on the first day of the new quarter as investors wait for the results of a private survey on Chinese factory activity.
The Nikkei futures contr… [+1805 chars]",Asia-Pacific markets poised to trade lower; survey on China's factory activity results ahead,https://www.cnbc.com/2022/07/01/asia-markets-caixin-manufacturing-pmi-japan-tankan-currencies-oil.html,-0.0516,0.132,0.724,0.145,-1,-0.296,0.0,0.937,0.062,-1,"['SINGAPORE', 'Asia-Pacific', 'future', 'pointed', 'lower', 'open', 'first', 'day', 'new', 'quarter', 'investor', 'wait', 'result', 'private', 'survey', 'Chinese', 'factory', 'activity', 'Nikkei', 'future', 'contr…', '+1805']"
92,2022-07-12,Futures in the Asia-Pacific pointed to a mixed open on Wednesday ahead of China trade data and central bank decisions in the region.,en,"{'id': None, 'name': 'CNBC'}",SINGAPORE Futures in the Asia-Pacific pointed to a mixed open on Wednesday ahead of China trade data and central bank decisions in the region. Investors will also be looking ahead to the U.S. inflati… [+1860 chars],Asia-Pacific markets poised to open mixed ahead of China trade data,https://www.cnbc.com/2022/07/13/asia-markets-china-exports-imports-central-banks-interest-rates-.html,0.25,0.167,0.833,0.0,1,0.0,0.0,1.0,0.0,0,"['SINGAPORE', 'Futures', 'Asia-Pacific', 'pointed', 'mixed', 'open', 'Wednesday', 'ahead', 'China', 'trade', 'data', 'central', 'bank', 'decision', 'region', 'Investors', 'also', 'looking', 'ahead', 'U.S.', 'inflati…', '+1860']"
93,2022-06-17,"If premarket stock gains hold, they'll do little to make a dent in this week's avalanche of selling.",en,"{'id': None, 'name': 'CNBC'}","Here are the most important news, trends and analysis that investors need to start their trading day:
1. Wall Street set to bounce but still tracking for a terrible week
Traders on the floor of the… [+3747 chars]",5 things to know before the stock market opens Friday,https://www.cnbc.com/2022/06/17/5-things-to-know-before-the-stock-market-opens-friday-june-17.html,0.0,0.0,1.0,0.0,0,-0.5579,0.038,0.86,0.102,-1,"['important', 'news', 'trend', 'analysis', 'investor', 'need', 'start', 'trading', 'day', '1', 'Wall', 'Street', 'set', 'bounce', 'still', 'tracking', 'terrible', 'week', 'Traders', 'floor', 'the…', '+3747']"
94,2022-06-15,U.S. stock futures rose Wednesday as Wall Street prepares for what could be an even more aggressive Fed rate hike.,en,"{'id': None, 'name': 'CNBC'}","Here are the most important news, trends and analysis that investors need to start their trading day:
1. Stocks set to bounce at the open ahead of the Fed's big rate decision
Traders on the floor o… [+5551 chars]",5 things to know before the stock market opens Wednesday,https://www.cnbc.com/2022/06/15/5-things-to-know-before-the-stock-market-opens-wednesday-june-15.html,0.0,0.0,1.0,0.0,0,0.2716,0.052,0.948,0.0,1,"['important', 'news', 'trend', 'analysis', 'investor', 'need', 'start', 'trading', 'day', '1', 'Stocks', 'set', 'bounce', 'open', 'ahead', 'Fed', 'big', 'rate', 'decision', 'Traders', 'floor', 'o…', '+5551']"
95,2022-07-15,"Investors are likely to switch their focus to earnings season, after the market's wild ride on rising and falling expectations for Federal Reserve rate hikes.",en,"{'id': None, 'name': 'CNBC'}","Traders on the floor of the NYSE, July 12, 2022.
Investors are likely to switch their focus to earnings season, after the market's wild ride on rising and falling expectations for Federal Reserve ra… [+5285 chars]",Earnings could be an even bigger catalyst for stocks after the market’s wild ride on rate fears,https://www.cnbc.com/2022/07/15/earnings-could-be-an-even-bigger-catalyst-for-stocks-after-the-markets-wild-ride-on-rate-fears.html,-0.4215,0.0,0.851,0.149,-1,-0.1531,0.0,0.956,0.044,-1,"['Traders', 'floor', 'NYSE', 'July', '12', '2022', 'Investors', 'likely', 'switch', 'focus', 'earnings', 'season', 'market', 'wild', 'ride', 'rising', 'falling', 'expectation', 'Federal', 'Reserve', 'ra…', '+5285']"
96,2022-07-02,"Some 68% of chief financial officers expect a recession to occur during the first half of 2023, according to a CNBC survey. Here's how to prep your portfolio.",en,"{'id': None, 'name': 'CNBC'}","Months of stock market volatility, surging inflation and rising interest rates have left many investors wondering if a recession is coming. 
The stock market tumbled again on Thursday, with the S&am… [+5377 chars]",Some experts say a recession is coming. Here's how to prepare your portfolio,https://www.cnbc.com/2022/07/02/some-experts-say-a-recession-is-coming-how-to-prepare-your-portfolio.html,-0.4215,0.0,0.797,0.203,-1,0.0516,0.084,0.838,0.078,1,"['Months', 'stock', 'market', 'volatility', 'surging', 'inflation', 'rising', 'interest', 'rate', 'left', 'many', 'investor', 'wondering', 'recession', 'coming', 'stock', 'market', 'tumbled', 'Thursday', 'am…', '+5377']"
97,2022-07-01,The relative success of the UK’s FTSE 100 Index provides a home-field advantage for a country reeling under price pressure.,en,"{'id': 'bloomberg', 'name': 'Bloomberg'}","Unloved for years, Britains FTSE 100 is getting a fresh look by retail traders. 
Despite recent gyrations, the benchmark stock index is a relative financial bright spot in a country bedeviled by inf… [+4375 chars]","Where to Invest in the UK: FTSE 100 Beats S&P, Nasdaq as Traders Fight Inflation - Bloomberg",https://www.bloomberg.com/news/articles/2022-07-01/where-to-invest-in-the-uk-ftse-100-beats-s-p-nasdaq-as-traders-fight-inflation,-0.3818,0.0,0.852,0.148,-1,0.3182,0.14,0.782,0.078,1,"['Unloved', 'year', 'Britains', 'FTSE', '100', 'getting', 'fresh', 'look', 'retail', 'trader', 'Despite', 'recent', 'gyration', 'benchmark', 'stock', 'index', 'relative', 'financial', 'bright', 'spot', 'country', 'bedeviled', 'inf…', '+4375']"
98,2022-06-14,Bianco Research President Jim Bianco sees the Fed's battle against inflation having a costly downside to stocks and bonds.,en,"{'id': None, 'name': 'CNBC'}","Until inflation peaks and the Federal Reserve stops hiking rates, market forecaster Jim Bianco warns Wall Street is on a one way trip to misery.
""The Fed only has one tool to bring in inflation and … [+3266 chars]","Wall Street is on a one way trip to misery until Fed hikes stop, market forecaster Jim Bianco warns",https://www.cnbc.com/2022/06/14/inflation-and-fed-sparking-one-way-trip-to-market-misery-jim-bianco.html,-0.743,0.0,0.673,0.327,-1,-0.6908,0.0,0.835,0.165,-1,"['inflation', 'peak', 'Federal', 'Reserve', 'stop', 'hiking', 'rate', 'market', 'forecaster', 'Jim', 'Bianco', 'warns', 'Wall', 'Street', 'one', 'way', 'trip', 'misery', 'Fed', 'one', 'tool', 'bring', 'inflation', '+3266']"
99,2022-06-16,"As Facebook looks to copy more features from TikTok, the popular short video service says it's not a social network",en,"{'id': None, 'name': 'CNBC'}",TikTok is fully aware that Meta CEO Mark Zuckerberg is retooling the Facebook and Instagram apps to be more like its own popular short video service. But TikTok has no interest in mimicking Facebook.… [+3456 chars],"TikTok exec: We're not a social network like Facebook, we're an entertainment platform",https://www.cnbc.com/2022/06/16/tiktok-were-an-entertainment-app-not-a-social-network-like-facebook.html,0.1754,0.188,0.671,0.142,1,0.6119,0.183,0.751,0.066,1,"['TikTok', 'fully', 'aware', 'Meta', 'CEO', 'Mark', 'Zuckerberg', 'retooling', 'Facebook', 'Instagram', 'apps', 'like', 'popular', 'short', 'video', 'service', 'TikTok', 'interest', 'mimicking', 'Facebook.…', '+3456']"
