,date,description,language,source,text,title,url,title_compound,title_pos,title_neu,title_neg,title_sent,text_compound,text_pos,text_neu,text_neg,text_sent,tokens
0,2022-06-16,Understand every aspect of the global economy – and know how to make your next move.,en,"{'id': 'bloomberg', 'name': 'Bloomberg'}","Bloomberg's Emily Chang breaks down the latest market moves with the Nasdaq 100 leading the charge in tumbling US stocks as global recession fears ramp up. Plus, what came out of the virtual meeting … [+50 chars]",Nasdaq Drops 4% and Twitter's All-Hands Meeting (Podcast),https://www.bloomberg.com/news/audio/2022-06-16/nasdaq-drops-4-and-twitter-s-all-hands-meeting-podcast,0.0,0.0,1.0,0.0,0,-0.6808,0.0,0.859,0.141,-1,"['Bloomberg', 'Emily', 'Chang', 'break', 'latest', 'market', 'move', 'Nasdaq', '100', 'leading', 'charge', 'tumbling', 'US', 'stock', 'global', 'recession', 'fear', 'ramp', 'Plus', 'came', 'virtual', 'meeting', '+50']"
1,2022-07-14,"The worst rout in more than a decade for the US tech-focused Nasdaq 100 Stock Index has turned into a buying opportunity for Indian retail investors, who boosted holdings of Tesla Inc., Amazon.com Inc and Apple Inc.",en,"{'id': 'bloomberg', 'name': 'Bloomberg'}","The worst rout in more than a decade for the US tech-focused Nasdaq 100 Stock Index has turned into a buying opportunity for Indian retail investors, who boosted holdings of 
Tesla Inc., 
Amazon.co… [+1129 chars]",US Tech Stocks Are Luring Indian Retail Investors Despite Rout - Bloomberg,https://www.bloomberg.com/news/articles/2022-07-14/us-tech-stocks-are-luring-indian-retail-investors-despite-rout,0.0,0.0,1.0,0.0,0,0.0516,0.135,0.761,0.104,1,"['worst', 'rout', 'decade', 'US', 'tech-focused', 'Nasdaq', '100', 'Stock', 'Index', 'turned', 'buying', 'opportunity', 'Indian', 'retail', 'investor', 'boosted', 'holding', 'Tesla', 'Inc.', 'Amazon.co…', '+1129']"
2,2022-06-28,"In a year that has seen widespread selling of technology stocks and long-time market leaders fall into bear territory, the woes of Netflix Inc. stand alone.",en,"{'id': 'bloomberg', 'name': 'Bloomberg'}","In a year that has seen widespread selling of technology stocks and long-time market leaders fall into bear territory, the woes of 
Netflix Inc. stand alone.
The video-streaming company has plummet… [+345 chars]",The Number of Netflix Bulls Is Dwindling,https://www.bloomberg.com/news/articles/2022-06-28/netflix-bulls-dwindle-as-year-s-collapse-nears-70-tech-watch,0.0772,0.178,0.822,0.0,1,-0.5994,0.0,0.86,0.14,-1,"['year', 'seen', 'widespread', 'selling', 'technology', 'stock', 'long-time', 'market', 'leader', 'fall', 'bear', 'territory', 'woe', 'Netflix', 'Inc.', 'stand', 'alone', 'video-streaming', 'company', 'plummet…', '+345']"
3,2022-07-05,"""Tech's become absolutely hated, maybe so hated that I think we could see a serious bounce,"" he said.",en,"{'id': None, 'name': 'CNBC'}","CNBC's Jim Cramer on Tuesday told investors his three stock picks from the worst and best performing stocks in the Nasdaq 100 during the first half of this year.
""Tech stocks were horrendous in the … [+2018 chars]",Jim Cramer says investors should eye these three tech names in the Nasdaq 100 - CNBC,https://www.cnbc.com/2022/07/05/jim-cramer-says-investors-should-eye-these-three-tech-names-in-the-nasdaq-100-.html,0.0,0.0,1.0,0.0,0,-0.5719,0.091,0.738,0.171,-1,"['CNBC', 'Jim', 'Cramer', 'Tuesday', 'told', 'investor', 'three', 'stock', 'pick', 'worst', 'best', 'performing', 'stock', 'Nasdaq', '100', 'first', 'half', 'year', 'Tech', 'stock', 'horrendous', '+2018']"
4,2022-06-30,"Skeptics have long made a sport of predicting that the decade-long rally in technology stocks was destined to reverse. At the halfway point of 2022, it seems like this is the year when they will be proven right.",en,"{'id': 'bloomberg', 'name': 'Bloomberg'}","Skeptics have long made a sport of predicting that the decade-long rally in technology stocks was destined to reverse. At the halfway point of 2022, it seems like this is the year when they will be p… [+6153 chars]",Tech-Heavy Nasdaq 100 (NDX) Heads for Historic Wipeout as US Economy Cools - Bloomberg,https://www.bloomberg.com/news/articles/2022-06-30/nasdaq-heads-for-historic-wipeout-as-economy-cools-tech-watch,0.0,0.0,1.0,0.0,0,0.2732,0.063,0.902,0.035,1,"['Skeptics', 'long', 'made', 'sport', 'predicting', 'decade-long', 'rally', 'technology', 'stock', 'destined', 'reverse', 'halfway', 'point', '2022', 'seems', 'like', 'year', 'p…', '+6153']"
5,2022-07-07,"A rally in risk assets this week is sending traders to some of the most speculative corners of the technology sector, where gains in beleaguered stocks are more than double those of Nasdaq 100’s advance.",en,"{'id': 'bloomberg', 'name': 'Bloomberg'}","A rally in risk assets this week is sending traders to some of the most speculative corners of the technology sector, where gains in beleaguered stocks are more than double those of Nasdaq 100s advan… [+305 chars]",Nasdaq Win Streak Is Fueled by Tech Losers Turning Into Winners - Bloomberg,https://www.bloomberg.com/news/articles/2022-07-07/nasdaq-win-streak-is-fueled-by-tech-losers-turning-into-winners,0.5423,0.358,0.466,0.176,1,0.4005,0.145,0.802,0.053,1,"['rally', 'risk', 'asset', 'week', 'sending', 'trader', 'speculative', 'corner', 'technology', 'sector', 'gain', 'beleaguered', 'stock', 'double', 'Nasdaq', '100', 'advan…', '+305']"
6,2022-07-11,"With technology stocks on track for their biggest annual decline on record, the earnings season has a lot riding on it.",en,"{'id': 'bloomberg', 'name': 'Bloomberg'}","With technology stocks on track for their biggest annual 
decline on record, the earnings season has a lot riding on it.
A tumultuous first half wiped out $5.6 trillion in market value from the Nas… [+6414 chars]",Tech Stocks News: Earnings Season Will Be Nail-Biting After Nasdaq Rout - Bloomberg,https://www.bloomberg.com/news/articles/2022-07-11/nail-biting-earnings-season-on-tap-after-nasdaq-rout-tech-watch,0.0,0.0,1.0,0.0,0,0.34,0.066,0.934,0.0,1,"['technology', 'stock', 'track', 'biggest', 'annual', 'decline', 'record', 'earnings', 'season', 'lot', 'riding', 'tumultuous', 'first', 'half', 'wiped', '5.6', 'trillion', 'market', 'value', 'Nas…', '+6414']"
7,2022-06-26,,en,"{'id': 'bloomberg', 'name': 'Bloomberg'}","Crypto curious stock investors are taking little comfort in the rebound in the shares of companies linked to the digital-asset world in the past week, with the sector underperforming just about every… [+627 chars]",Crypto Stocks Show Why They're Among the Riskiest of Risk Assets,https://www.bloomberg.com/news/articles/2022-06-26/crypto-stocks-show-why-they-re-among-the-riskiest-of-risk-assets,-0.4404,0.119,0.559,0.322,-1,0.6915,0.178,0.822,0.0,1,"['Crypto', 'curious', 'stock', 'investor', 'taking', 'little', 'comfort', 'rebound', 'share', 'company', 'linked', 'digital-asset', 'world', 'past', 'week', 'sector', 'underperforming', 'every…', '+627']"
8,2022-07-08,"Crypto mining giant Marathon Digital Holdings Inc. had its best weekly gain since February 2021, leading a rally in digital-asset shares as the crypto market enjoyed a respite from recent steep declines. The stock’s gains, while impressive, were nowhere near …",en,"{'id': 'bloomberg', 'name': 'Bloomberg'}","Crypto mining giant 
Marathon Digital Holdings Inc. had its best weekly gain since February 2021, leading a rally in digital-asset shares as the crypto market enjoyed a respite from recent steep dec… [+603 chars]",Crypto Miner Marathon's 54% Surge Still Leaves Stock Deep in Red,https://www.bloomberg.com/news/articles/2022-07-08/crypto-miner-marathon-s-54-surge-still-leaves-stock-deep-in-red,0.0,0.0,1.0,0.0,0,0.9201,0.319,0.681,0.0,1,"['Crypto', 'mining', 'giant', 'Marathon', 'Digital', 'Holdings', 'Inc.', 'best', 'weekly', 'gain', 'since', 'February', '2021', 'leading', 'rally', 'digital-asset', 'share', 'crypto', 'market', 'enjoyed', 'respite', 'recent', 'steep', 'dec…', '+603']"
9,2022-06-17,Here's Where Investors Took Cover in Miserable Week for Tech Stocks  Bloomberg,en,"{'id': 'bloomberg', 'name': 'Bloomberg'}","Its been an ugly week for tech stocks. But it turns out that investors who stuck with the likes of Oracle Corp. and Cisco Systems Inc. -- cash generating, dividend-paying companies -- managed to beat… [+2469 chars]",Here's Where Investors Took Cover in Miserable Week for Tech Stocks - Bloomberg,https://www.bloomberg.com/news/articles/2022-06-17/oracle-cisco-offer-tech-investors-some-cover-in-miserable-week,-0.4939,0.0,0.775,0.225,-1,0.0129,0.087,0.803,0.11,0,"['ugly', 'week', 'tech', 'stock', 'turn', 'investor', 'stuck', 'like', 'Oracle', 'Corp.', 'Cisco', 'Systems', 'Inc.', '--', 'cash', 'generating', 'dividend-paying', 'company', '--', 'managed', 'beat…', '+2469']"
10,2022-06-24,Here’s the key business news from London-listed companies this morning.,en,"{'id': 'bloomberg', 'name': 'Bloomberg'}","Heres the key business news from London-listed companies this morning.
Retail Sales: The volume of goods sold in stores and online 
fell 0.5% from April, as soaring food prices and the wider cost-o… [+2552 chars]",Retail Sales Drop as Flurry of Deals Continues: The London Rush,https://www.bloomberg.com/news/articles/2022-06-24/retail-sales-drop-as-flurry-of-deals-continues-the-london-rush,-0.2732,0.0,0.826,0.174,-1,0.0,0.0,1.0,0.0,0,"['Heres', 'key', 'business', 'news', 'London-listed', 'company', 'morning', 'Retail', 'Sales', 'volume', 'good', 'sold', 'store', 'online', 'fell', '0.5', 'April', 'soaring', 'food', 'price', 'wider', 'cost-o…', '+2552']"
11,2022-06-29,"Wall Street analysts are starting to cut earnings estimates for some of the world’s biggest technology companies, undermining the argument that their stocks look cheap after this year’s market rout.",en,"{'id': 'bloomberg', 'name': 'Bloomberg'}","Wall Street analysts are starting to cut earnings estimates for some of the worlds biggest technology companies, undermining the argument that their stocks look cheap after this years market rout. 
… [+5889 chars]",JPMorgan Piles On With Estimate Cuts Before Earnings: Tech Watch - Bloomberg,https://www.bloomberg.com/news/articles/2022-06-29/wall-street-s-rosy-profit-view-is-starting-to-fade-tech-watch,-0.296,0.0,0.82,0.18,-1,-0.7269,0.0,0.803,0.197,-1,"['Wall', 'Street', 'analyst', 'starting', 'cut', 'earnings', 'estimate', 'world', 'biggest', 'technology', 'company', 'undermining', 'argument', 'stock', 'look', 'cheap', 'year', 'market', 'rout', '+5889']"
12,2022-06-27,"Good morning, it’s Ainsley here with a roundup of the morning’s news to kick your day off.",en,"{'id': 'bloomberg', 'name': 'Bloomberg'}","Good morning, its Ainsley here with a roundup of the mornings news to kick your day off.  
Todays must-reads:
Whats happening around our region this morning
A chip at the glass ceiling. Women hold… [+3005 chars]",Australia Briefing: Slow Crawl to Gender Equality,https://www.bloomberg.com/news/newsletters/2022-06-27/australia-news-today-gender-pay-gap-women-on-boards-migration,0.0,0.0,1.0,0.0,0,0.4404,0.081,0.919,0.0,1,"['Good', 'morning', 'Ainsley', 'roundup', 'morning', 'news', 'kick', 'day', 'Todays', 'must-reads', 'Whats', 'happening', 'around', 'region', 'morning', 'chip', 'glass', 'ceiling', 'Women', 'hold…', '+3005']"
13,2022-06-18,Get caught up.,en,"{'id': 'bloomberg', 'name': 'Bloomberg'}","A US recession seemed avoidable even earlier this month. But central banks that 
fell behind the curve as prices skyrocketed are scrambling to catch up, and the Fed under Chair Jerome Powell raised … [+3264 chars]",Your Weekend Reading: The Fed Makes a Big Move Against Inflation,https://www.bloomberg.com/news/newsletters/2022-06-18/bloomberg-weekend-reading-the-fed-makes-its-big-move-against-inflation,0.0,0.0,1.0,0.0,0,-0.2263,0.0,0.946,0.054,-1,"['US', 'recession', 'seemed', 'avoidable', 'even', 'earlier', 'month', 'central', 'bank', 'fell', 'behind', 'curve', 'price', 'skyrocketed', 'scrambling', 'catch', 'Fed', 'Chair', 'Jerome', 'Powell', 'raised', '+3264']"
14,2022-06-30,Just four factors explain 88% of the variance in the digital currency’s price over the last four years.,en,"{'id': 'bloomberg', 'name': 'Bloomberg'}","Now that the cryptocurrency market has rebounded somewhat from the mid-June lows which were as low as any since 2020 and volatility is muted by crypto standards, many investors are asking if weve see… [+6300 chars]",Bitcoin's Fair Value Is Tied to Gold and Tech Stocks - Bloomberg,https://www.bloomberg.com/opinion/articles/2022-06-30/bitcoin-s-fair-value-is-tied-to-gold-and-tech-stocks,0.5719,0.343,0.657,0.0,1,-0.4404,0.0,0.897,0.103,-1,"['cryptocurrency', 'market', 'rebounded', 'somewhat', 'mid-June', 'low', 'low', 'since', '2020', 'volatility', 'muted', 'crypto', 'standard', 'many', 'investor', 'asking', 'weve', 'see…', '+6300']"
15,2022-07-04,Stock futures slid in overnight trading after the major averages finished another losing week.,en,"{'id': None, 'name': 'CNBC'}","Stock futures were flat in overnight trading after the major averages finished another losing week.
Stock futures tied to the Dow Jones Industrial Average slipped 30 points or 0.11%. S&amp;P 500 fut… [+1524 chars]",Stock futures slide after another losing week on Wall Street,https://www.cnbc.com/2022/07/04/stock-market-futures-open-to-close-news.html,-0.3818,0.0,0.776,0.224,-1,-0.3818,0.0,0.927,0.073,-1,"['Stock', 'future', 'flat', 'overnight', 'trading', 'major', 'average', 'finished', 'another', 'losing', 'week', 'Stock', 'future', 'tied', 'Dow', 'Jones', 'Industrial', 'Average', 'slipped', '30', 'point', '0.11', 'P', 'fut…', '+1524']"
16,2022-06-26,Wall Street is set to wrap up the worst first half for stocks in decades this week.,en,"{'id': None, 'name': 'CNBC'}","U.S. stock futures were little changed on Sunday night following a major rebound last week from this year's steep declines. Despite the bounce, Wall Street is preparing to wrap up the worst first hal… [+1446 chars]",Stock futures were little changed following a major comeback week for stocks,https://www.cnbc.com/2022/06/26/stock-market-futures-open-to-close-news.html,0.0,0.0,1.0,0.0,0,-0.6249,0.0,0.892,0.108,-1,"['U.S.', 'stock', 'future', 'little', 'changed', 'Sunday', 'night', 'following', 'major', 'rebound', 'last', 'week', 'year', 'steep', 'decline', 'Despite', 'bounce', 'Wall', 'Street', 'preparing', 'wrap', 'worst', 'first', 'hal…', '+1446']"
17,2022-07-15,Alibaba Group Holding Ltd. led a drop in Chinese tech shares after the firm was reported to be facing an inquiry in connection with the theft of a vast police database.,en,"{'id': 'bloomberg', 'name': 'Bloomberg'}","Alibaba Group Holding Ltd. led a drop in Chinese tech shares after the firm was reported to be facing an 
inquiry in connection with the theft of a vast police database.
The e-commerce giants stock… [+1024 chars]",Alibaba Leads Decline in China Tech Shares on Report of Inquiry - Bloomberg,https://www.bloomberg.com/news/articles/2022-07-15/alibaba-leads-decline-in-china-tech-shares-on-report-of-inquiry,0.296,0.167,0.833,0.0,1,0.0258,0.059,0.885,0.056,0,"['Alibaba', 'Group', 'Holding', 'Ltd.', 'led', 'drop', 'Chinese', 'tech', 'share', 'firm', 'reported', 'facing', 'inquiry', 'connection', 'theft', 'vast', 'police', 'database', 'e-commerce', 'giant', 'stock…', '+1024']"
18,2022-06-23,Changpeng Zhao built Binance into the world’s biggest digital currency exchange. Now he faces a looming regulatory crackdown in a brutal crypto winter.,en,"{'id': 'bloomberg', 'name': 'Bloomberg'}","During the first few months of this yearback when buying digital tokens named after dog memes was still seen, at least in some of the most forward-thinking circles, as a perfectly reasonable way to p… [+30069 chars]",Can Crypto's Richest Man Stand the Cold?,https://www.bloomberg.com/news/features/2022-06-23/binance-bnb-ceo-moves-to-dubai-as-us-regulators-target-the-crypto-exchange,0.5267,0.362,0.638,0.0,1,0.6369,0.107,0.893,0.0,1,"['first', 'month', 'yearback', 'buying', 'digital', 'token', 'named', 'dog', 'meme', 'still', 'seen', 'least', 'forward-thinking', 'circle', 'perfectly', 'reasonable', 'way', 'p…', '+30069']"
19,2022-07-06,The three major averages ended Wednesday’s session higher after the release of the Federal Reserve’s June meeting minutes.,en,"{'id': None, 'name': 'CNBC'}","U.S. stock futures rose slightly on Wednesday night as investors digested the most recent meeting minutes from the Federal Reserve.
Dow Jones Industrial Average futures rose by 26 points, or 0.1%. S… [+1768 chars]",Stock futures rise slightly following third straight day of gains for S&P 500,https://www.cnbc.com/2022/07/06/stock-market-futures-open-to-close-news.html,0.4654,0.268,0.732,0.0,1,0.0,0.0,1.0,0.0,0,"['U.S.', 'stock', 'future', 'rose', 'slightly', 'Wednesday', 'night', 'investor', 'digested', 'recent', 'meeting', 'minute', 'Federal', 'Reserve', 'Dow', 'Jones', 'Industrial', 'Average', 'future', 'rose', '26', 'point', '0.1', 'S…', '+1768']"
20,2022-06-21,U.S. stock index futures were little changed during overnight trading Tuesday.,en,"{'id': None, 'name': 'CNBC'}","U.S. stock index futures were flat overnight Tuesday after the major averages jumped in regular trading hours, attempting to claw back some losses following weeks of selling.
Futures contracts tied … [+2316 chars]",Stock futures are flat after markets claw back some losses from weeks of selling,https://www.cnbc.com/2022/06/21/stock-market-futures-open-to-close-news.html,-0.4019,0.0,0.828,0.172,-1,-0.4019,0.0,0.92,0.08,-1,"['U.S.', 'stock', 'index', 'future', 'flat', 'overnight', 'Tuesday', 'major', 'average', 'jumped', 'regular', 'trading', 'hour', 'attempting', 'claw', 'back', 'loss', 'following', 'week', 'selling', 'Futures', 'contract', 'tied', '+2316']"
21,2022-06-22,S&P 500 futures were flat Wednesday night after the major indexes slipped into the red at the end of regular trading.,en,"{'id': None, 'name': 'CNBC'}",S&amp;P 500 futures were flat Wednesday night after the major indexes slipped into the red at the end of regular trading and investors weighed the likelihood of a recession after Federal Reserve chai… [+1901 chars],"S&P 500 futures are little changed after the major averages dip, investors mull recession concern",https://www.cnbc.com/2022/06/22/stock-futures-are-little-changed-after-major-averages-dip-investors-mull-slowdown.html,-0.4215,0.0,0.833,0.167,-1,-0.4215,0.0,0.922,0.078,-1,"['P', 'future', 'flat', 'Wednesday', 'night', 'major', 'index', 'slipped', 'red', 'end', 'regular', 'trading', 'investor', 'weighed', 'likelihood', 'recession', 'Federal', 'Reserve', 'chai…', '+1901']"
22,2022-06-14,"The S&P 500 suffered a five-day losing streak on Tuesday, dipping deeper into bear market territory.",en,"{'id': None, 'name': 'CNBC'}","Stock futures were little changed in overnight trading Tuesday as investors anxiously awaited the Federal Reserve's aggressive action to tame surging inflation.
Futures on the Dow Jones Industrial A… [+2459 chars]",Stock futures are flat as investors brace for a big Fed rate hike,https://www.cnbc.com/2022/06/14/stock-market-futures-open-to-close-news.html,0.0,0.0,1.0,0.0,0,-0.3818,0.0,0.859,0.141,-1,"['Stock', 'future', 'little', 'changed', 'overnight', 'trading', 'Tuesday', 'investor', 'anxiously', 'awaited', 'Federal', 'Reserve', 'aggressive', 'action', 'tame', 'surging', 'inflation', 'Futures', 'Dow', 'Jones', 'Industrial', 'A…', '+2459']"
23,2022-06-30,U.S. stock futures fell Thursday night after the S&P 500 closed out its worst first-half performance in decades.,en,"{'id': None, 'name': 'CNBC'}","U.S. stock futures fell Thursday night after the S&amp;P 500 closed out its worst first-half performance in decades.
Futures tied to the Dow Jones Industrial Average traded 67 points lower, or 0.2%.… [+2522 chars]",Stock futures slip after the S&P 500’s worst first half since 1970,https://www.cnbc.com/2022/06/30/stock-market-futures-open-to-close-news.html,-0.6249,0.0,0.728,0.272,-1,-0.743,0.0,0.836,0.164,-1,"['U.S.', 'stock', 'future', 'fell', 'Thursday', 'night', 'P', 'closed', 'worst', 'first-half', 'performance', 'decade', 'Futures', 'tied', 'Dow', 'Jones', 'Industrial', 'Average', 'traded', '67', 'point', 'lower', '0.2', '.…', '+2522']"
24,2022-06-23,Shares of MicroStrategy Inc. have been hit hard this year as its once-winning approach of being a tech company that also holds billions of dollars in Bitcoin sends investors rushing for the exit. Analysts are holding fast in their bullishness.,en,"{'id': 'bloomberg', 'name': 'Bloomberg'}","Shares of 
MicroStrategy Inc. have been hit hard this year as its once-winning approach of being a tech company that also holds billions of dollars in Bitcoin sends investors rushing for the exit. A… [+5258 chars]","MicroStrategy (MSTR) Bulls Unfazed by Bitcoin Drop (BTC USD), Tech Selloff - Bloomberg",https://www.bloomberg.com/news/articles/2022-06-23/microstrategy-bulls-unfazed-by-double-dose-of-pain-tech-watch,-0.2732,0.0,0.84,0.16,-1,0.2023,0.06,0.902,0.038,1,"['Shares', 'MicroStrategy', 'Inc.', 'hit', 'hard', 'year', 'once-winning', 'approach', 'tech', 'company', 'also', 'hold', 'billion', 'dollar', 'Bitcoin', 'sends', 'investor', 'rushing', 'exit', 'A…', '+5258']"
25,2022-07-12,Investors awaited a key inflation report that is expected to show a fresh high going back to the 1980s.,en,"{'id': None, 'name': 'CNBC'}","Stock futures were little changed in overnight trading on Tuesday as investors awaited a key inflation report that is expected to show a fresh high.
Futures on the Dow Jones Industrial Average edged… [+1496 chars]",Stock futures are flat with all eyes on June's inflation report,https://www.cnbc.com/2022/07/12/stock-market-futures-open-to-close-news.html,0.0,0.0,1.0,0.0,0,0.296,0.067,0.901,0.032,1,"['Stock', 'future', 'little', 'changed', 'overnight', 'trading', 'Tuesday', 'investor', 'awaited', 'key', 'inflation', 'report', 'expected', 'show', 'fresh', 'high', 'Futures', 'Dow', 'Jones', 'Industrial', 'Average', 'edged…', '+1496']"
26,2022-06-30,European stocks are expected to open lower on Thursday as investor concerns over the health of the global economy persist.,en,"{'id': None, 'name': 'CNBC'}","LONDON European stocks are expected to open lower on Thursday as investor concerns over the health of the global economy persist.
The U.K.'s FTSE index is seen opening 19 points lower at 7,290, Germ… [+1815 chars]",European markets set to continue declines as recession concerns persist,https://www.cnbc.com/2022/06/30/european-markets-open-to-close-as-recession-concerns-persist.html,-0.4215,0.0,0.763,0.237,-1,-0.5267,0.0,0.885,0.115,-1,"['LONDON', 'European', 'stock', 'expected', 'open', 'lower', 'Thursday', 'investor', 'concern', 'health', 'global', 'economy', 'persist', 'U.K.', 'FTSE', 'index', 'seen', 'opening', '19', 'point', 'lower', '7,290', 'Germ…', '+1815']"
27,2022-06-15,U.S. stock futures rose Wednesday as Wall Street prepares for what could be an even more aggressive Fed rate hike.,en,"{'id': None, 'name': 'CNBC'}","BY THE NUMBERS
U.S. stock futures rose Wednesday as Wall Street prepares for what could be an even more aggressive Federal Reserve interest rate hike than the market was expecting just a few days ag… [+4717 chars]",What to watch today: Stocks set to bounce ahead of the Fed's big rate decision,https://www.cnbc.com/2022/06/15/what-to-watch-today-stocks-set-to-bounce-ahead-of-the-feds-big-rate-decision.html,0.0,0.0,1.0,0.0,0,0.2748,0.077,0.874,0.049,1,"['NUMBERS', 'U.S.', 'stock', 'future', 'rose', 'Wednesday', 'Wall', 'Street', 'prepares', 'could', 'even', 'aggressive', 'Federal', 'Reserve', 'interest', 'rate', 'hike', 'market', 'expecting', 'day', 'ag…', '+4717']"
28,2022-07-06,Here are the most important news items that investors need to start their trading day.,en,"{'id': None, 'name': 'CNBC'}","Traders on the floor of the NYSE, June 27, 2022.
Here are the most important news items that investors need to start their trading day:
1. Stocks in a holding pattern
U.S. stock futures were essen… [+3034 chars]",5 things to know before the stock market opens Wednesday,https://www.cnbc.com/2022/07/06/5-things-to-know-before-the-stock-market-opens-wednesday-july-6.html,0.0,0.0,1.0,0.0,0,0.2716,0.055,0.945,0.0,1,"['Traders', 'floor', 'NYSE', 'June', '27', '2022', 'important', 'news', 'item', 'investor', 'need', 'start', 'trading', 'day', '1', 'Stocks', 'holding', 'pattern', 'U.S.', 'stock', 'future', 'essen…', '+3034']"
29,2022-07-01,"No one would have predicted it a few months ago, but Chinese technology stocks now are a rare pocket of strength in global markets. A wave of selling by corporate insiders is calling into question how far the rally can go.",en,"{'id': 'bloomberg', 'name': 'Bloomberg'}","No one would have predicted it a few months ago, but Chinese technology stocks now are a rare pocket of strength in global markets. A wave of selling by corporate insiders is calling into question ho… [+4171 chars]",China Tech Rally Sends Insiders Rushing for Exits: Tech Watch - Bloomberg,https://www.bloomberg.com/news/articles/2022-07-01/china-tech-rally-sends-insiders-rushing-for-exits-tech-watch,0.0,0.0,1.0,0.0,0,0.5719,0.111,0.848,0.041,1,"['one', 'would', 'predicted', 'month', 'ago', 'Chinese', 'technology', 'stock', 'rare', 'pocket', 'strength', 'global', 'market', 'wave', 'selling', 'corporate', 'insider', 'calling', 'question', 'ho…', '+4171']"
